<?xml version="1.0" encoding="UTF-8"?>
<!ELEMENT animeList (anime*)>
<!ELEMENT anime (name+, images, seasons, priceList)>
<!ATTLIST anime
			id			ID				#REQUIRED
			isfinished	(true | false)	#REQUIRED
			episodeNum	CDATA			#REQUIRED>
<!ELEMENT name (#PCDATA)>
<!ATTLIST name language CDATA #IMPLIED>
<!ELEMENT images (thumbnail, preview+)>
<!ELEMENT thumbnail (#PCDATA)>
<!ATTLIST thumbnail size CDATA #IMPLIED>
<!ELEMENT preview (#PCDATA)>
<!ATTLIST preview size CDATA #IMPLIED>
<!ELEMENT seasons (season*)>
<!ATTLIST seasons currentSeason CDATA "1">
<!ELEMENT season (#PCDATA)>
<!ATTLIST season seasonId IDREF #REQUIRED>
<!ELEMENT priceList (price+)>
<!ELEMENT price (#PCDATA)>
<!ATTLIST price 
			platform	(bilibili | tecent | iqiyi | unknown)	"unknown"
			currency	CDATA 	#IMPLIED>